{"request_id":"qa-synthetic-walk","used_context":{"location_source":"gps_rounded","location_label":"Синтетическая QA-локация","radius_m":1500,"time_budget_min":60,"mode":"walk","filters":["парк"],"now":"2026-10-18T17:00:00+05:00"},"recommendations":[{"poi_id":"test:park","name":"QA TEST парк","category":"park","lat":51.129,"lon":71.43,"distance_m":111,"travel_min":2,"why":"Тестовая зелёная зона для прогулки.","visit_min":[15,20],"what_to_do":"Пройти по тестовому парку 15–20 минут.","open_status":"unknown","open_confidence":"none","source":"poi_data","source_url":"https://example.com/qa/park","rating":null}],"route":null,"notes":["Режим работы неизвестен; это синтетическая фикстура, не реальная рекомендация."],"disclaimer":"Синтетические тестовые данные; не использовать как советы о реальных местах."}
